{
  "schemaVersion": 1,
  "observationId": "obs-2",
  "kind": "WEIRD_FUTURE_KIND",
  "scope": {
    "projectId": "project-demo",
    "artifactDigest": "0123456789abcdef0123456789abcdef0123456789abcdef0123456789abcdef",
    "scanId": "scan-1",
    "taskId": "task-1"
  },
  "observedAt": "2026-07-28T02:00:00Z",
  "coverageStatus": "UNKNOWN",
  "stopReason": "UNKNOWN_KIND"
}
